{
  "$schema": "https://raw.githubusercontent.com/Gorgorito12/aoe3-mods-catalog/main/schema/mod.schema.json",
  "id": "test-mod",
  "displayName": "Test Mod",
  "subtitle": "DEMO — catalog test",
  "accentColor": "#9b59b6",
  "author": "papillo12",
  "officialWebsite": "https://github.com/papillo12/aoe3-mods-catalog",
  "description": {
    "en": "Demo mod added to verify the catalog flow end-to-end. Safe to delete after testing.",
    "es": "Mod de demostración para verificar el flujo del catálogo de extremo a extremo. Seguro de eliminar tras la prueba."
  },
  "install": {
    "type": "InPlaceOverlay",
    "defaultFolder": "",
    "probeFile": "test.exe",
    "executable": "test.exe",
    "arguments": ""
  },
  "update": {
    "mechanism": "Manual"
  }
}
