{
  "$schema": "https://raw.githubusercontent.com/Gorgorito12/aoe3-mods-catalog/main/schema/mod.schema.json",
  "id": "improvement-mod",
  "displayName": "Improvement Mod",
  "subtitle": "AoE3:TAD overhaul",
  "accentColor": "#3a8cd9",
  "author": "Improvement Mod Team",
  "officialWebsite": "https://www.moddb.com/mods/improvement-mod",
  "description": {
    "en": "Overhaul mod for AoE3: The Asian Dynasties. Ships its own age3m.exe alongside the original AoE3 binaries; the launcher downloads the mod's release archive and overlays it on the existing AoE3 install.",
    "es": "Mod de mejora para AoE3: The Asian Dynasties. Trae su propio age3m.exe junto a los binarios originales de AoE3; el launcher descarga el archivo de la release del mod y lo aplica sobre la instalación existente de AoE3."
  },
  "sourceRepo": "papillo12/Improvement-Mod",
  "approvedReleaseTag": "Improvement-Mod",
  "install": {
    "type": "InPlaceOverlay",
    "defaultFolder": "",
    "probeFile": "age3m.exe",
    "executable": "age3m.exe",
    "arguments": ""
  },
  "update": {
    "mechanism": "GitHubReleases"
  }
}
